{
  "id": "mars_mercury_trine",
  "kind": "transit-to-natal",
  "transiting": "mars",
  "natal": "mercury",
  "aspect": "trine",
  "plainTranslation": "Energy and friction flows easily through your thinking and words. Days to weeks.",
  "policy": "Transit-to-natal entries are ordered: transiting planet to natal planet. Do not apply same-moment aspect exclusions. Interpret as an active pressure or opening, not a guaranteed event.",
  "note": "Imported from project-authored transit-to-natal matrix material. Source file was not copied into the repository.",
  "voiceNeutral": true,
  "status": "DRAFT"
}
