{
  "id": "pluto_neptune_sextile",
  "kind": "transit-to-natal",
  "transiting": "pluto",
  "natal": "neptune",
  "aspect": "sextile",
  "plainTranslation": "Deep transformation opens a door in your dreams and ideals - if you take it. Years - background, not a daily event.",
  "policy": "Transit-to-natal entries are ordered: transiting planet to natal planet. Do not apply same-moment aspect exclusions. Interpret as an active pressure or opening, not a guaranteed event.",
  "note": "Imported from project-authored transit-to-natal matrix material. Source file was not copied into the repository.",
  "voiceNeutral": true,
  "status": "DRAFT"
}
