{
  "id": "pluto_mercury_sextile",
  "kind": "transit-to-natal",
  "transiting": "pluto",
  "natal": "mercury",
  "aspect": "sextile",
  "plainTranslation": "An opening for deep research or honest confrontation with what is real. Ask the real question.",
  "policy": "Transit-to-natal entries are ordered: transiting planet to natal planet. Do not apply same-moment aspect exclusions. Interpret as an active pressure or opening, not a guaranteed event.",
  "note": "Imported from project-authored transit-to-natal core material. Source file was not copied into the repository.",
  "voiceNeutral": true,
  "status": "DRAFT"
}
