{
  "id": "saturn_venus_sextile",
  "kind": "transit-to-natal",
  "transiting": "saturn",
  "natal": "venus",
  "aspect": "sextile",
  "plainTranslation": "A chance to make a relationship or your finances more solid. Make the steady choice.",
  "policy": "Transit-to-natal entries are ordered: transiting planet to natal point. Do not apply same-moment aspect exclusions. Interpret as an active pressure or opening, not a guaranteed event.",
  "note": "Imported from project-authored transit-to-natal matrix material. Source file was not copied into the repository.",
  "voiceNeutral": true,
  "status": "REVIEWED"
}
