{
  "id": "venus_neptune_opposition",
  "kind": "transit-to-natal",
  "transiting": "venus",
  "natal": "neptune",
  "aspect": "opposition",
  "plainTranslation": "Warmth and attraction shows up in your dreams and ideals, often through other people. Days.",
  "policy": "Transit-to-natal entries are ordered: transiting planet to natal planet. Do not apply same-moment aspect exclusions. Interpret as an active pressure or opening, not a guaranteed event.",
  "note": "Imported from project-authored transit-to-natal matrix material. Source file was not copied into the repository.",
  "voiceNeutral": true,
  "status": "DRAFT"
}
