{
  "id": "mercury_moon_square",
  "kind": "transit-to-natal",
  "transiting": "mercury",
  "natal": "moon",
  "aspect": "square",
  "plainTranslation": "Thinking grates against your mood. Worry, overthinking feelings, restless mind. Get the thought out of your head and onto the page before it loops.",
  "policy": "Transit-to-natal entries are ordered: transiting planet to natal point. Do not apply same-moment aspect exclusions. Interpret as an active pressure or opening, not a guaranteed event.",
  "note": "Imported from project-authored transit-to-natal matrix material. Source file was not copied into the repository.",
  "voiceNeutral": true,
  "status": "REVIEWED"
}
