{
  "id": "uranus_venus_sextile",
  "kind": "transit-to-natal",
  "transiting": "uranus",
  "natal": "venus",
  "aspect": "sextile",
  "plainTranslation": "An opening for fresh romance or a new income angle. Try something different.",
  "policy": "Transit-to-natal entries are ordered: transiting planet to natal planet. Do not apply same-moment aspect exclusions. Interpret as an active pressure or opening, not a guaranteed event.",
  "note": "Imported from project-authored transit-to-natal core material. Source file was not copied into the repository.",
  "voiceNeutral": true,
  "status": "DRAFT"
}
