{
  "id": "neptune_moon_sextile",
  "kind": "transit-to-natal",
  "transiting": "neptune",
  "natal": "moon",
  "aspect": "sextile",
  "plainTranslation": "An opening for emotional and creative sensitivity. Use it; keep your footing.",
  "policy": "Transit-to-natal entries are ordered: transiting planet to natal planet. Do not apply same-moment aspect exclusions. Interpret as an active pressure or opening, not a guaranteed event.",
  "note": "Imported from project-authored transit-to-natal core material. Source file was not copied into the repository.",
  "voiceNeutral": true,
  "status": "DRAFT"
}
