{
  "id": "uranus_moon_trine",
  "kind": "transit-to-natal",
  "transiting": "uranus",
  "natal": "moon",
  "aspect": "trine",
  "plainTranslation": "Emotional freedom comes easily. Refreshing change, more room. Enjoy the looseness.",
  "policy": "Transit-to-natal entries are ordered: transiting planet to natal planet. Do not apply same-moment aspect exclusions. Interpret as an active pressure or opening, not a guaranteed event.",
  "note": "Imported from project-authored transit-to-natal core material. Source file was not copied into the repository.",
  "voiceNeutral": true,
  "status": "DRAFT"
}
