{
  "id": "mars_uranus_opposition",
  "kind": "transit-to-natal",
  "transiting": "mars",
  "natal": "uranus",
  "aspect": "opposition",
  "plainTranslation": "Energy and friction shows up in your need for freedom, often through other people. Days to weeks.",
  "policy": "Transit-to-natal entries are ordered: transiting planet to natal point. Do not apply same-moment aspect exclusions. Interpret as an active pressure or opening, not a guaranteed event.",
  "note": "Imported from project-authored transit-to-natal matrix material. Source file was not copied into the repository.",
  "voiceNeutral": true,
  "status": "DRAFT"
}
