{
  "id": "saturn_sun_sextile",
  "kind": "transit-to-natal",
  "transiting": "saturn",
  "natal": "sun",
  "aspect": "sextile",
  "plainTranslation": "An opening to build something durable around your goals. Do the steady work.",
  "policy": "Transit-to-natal entries are ordered: transiting planet to natal planet. Do not apply same-moment aspect exclusions. Interpret as an active pressure or opening, not a guaranteed event.",
  "note": "Imported from project-authored transit-to-natal core material. Source file was not copied into the repository.",
  "voiceNeutral": true,
  "status": "DRAFT"
}
