{
  "id": "venus_mars_square",
  "kind": "transit-to-natal",
  "transiting": "venus",
  "natal": "mars",
  "aspect": "square",
  "plainTranslation": "Warmth and attraction presses on your drive and temper, forcing an adjustment. Days.",
  "policy": "Transit-to-natal entries are ordered: transiting planet to natal planet. Do not apply same-moment aspect exclusions. Interpret as an active pressure or opening, not a guaranteed event.",
  "note": "Imported from project-authored transit-to-natal matrix material. Source file was not copied into the repository.",
  "voiceNeutral": true,
  "status": "DRAFT"
}
