{
  "id": "mars_ascendant_sextile",
  "kind": "transit-to-natal",
  "transiting": "mars",
  "natal": "ascendant",
  "aspect": "sextile",
  "plainTranslation": "Your energy supports your presence. You come across as capable and direct. A good window to put yourself forward and make a move.",
  "policy": "Transit-to-natal entries are ordered: transiting planet to natal point. Do not apply same-moment aspect exclusions. Interpret as an active pressure or opening, not a guaranteed event.",
  "note": "Imported from project-authored transit-to-natal matrix material. Source file was not copied into the repository.",
  "voiceNeutral": true,
  "status": "REVIEWED"
}
