{
  "id": "venus_pluto_conjunction",
  "kind": "transit-to-natal",
  "transiting": "venus",
  "natal": "pluto",
  "aspect": "conjunction",
  "plainTranslation": "Warmth and attraction arrives full-force in your power and depth. Days.",
  "policy": "Transit-to-natal entries are ordered: transiting planet to natal point. Do not apply same-moment aspect exclusions. Interpret as an active pressure or opening, not a guaranteed event.",
  "note": "Imported from project-authored transit-to-natal matrix material. Source file was not copied into the repository.",
  "voiceNeutral": true,
  "status": "DRAFT"
}
