{
  "id": "sun_uranus_trine",
  "kind": "transit-to-natal",
  "transiting": "sun",
  "natal": "uranus",
  "aspect": "trine",
  "plainTranslation": "Vitality and focus flows easily through your need for freedom. Days.",
  "policy": "Transit-to-natal entries are ordered: transiting planet to natal point. Do not apply same-moment aspect exclusions. Interpret as an active pressure or opening, not a guaranteed event.",
  "note": "Imported from project-authored transit-to-natal matrix material. Source file was not copied into the repository.",
  "voiceNeutral": true,
  "status": "DRAFT"
}
