{
  "id": "moon_jupiter_sextile",
  "kind": "transit-to-natal",
  "transiting": "moon",
  "natal": "jupiter",
  "aspect": "sextile",
  "plainTranslation": "Shifting feeling opens a door in your sense of growth and faith - if you take it. Hours.",
  "policy": "Transit-to-natal entries are ordered: transiting planet to natal planet. Do not apply same-moment aspect exclusions. Interpret as an active pressure or opening, not a guaranteed event.",
  "note": "Imported from project-authored transit-to-natal matrix material. Source file was not copied into the repository.",
  "voiceNeutral": true,
  "status": "DRAFT"
}
